Title,Action,Preference
"WHO Declares Malaria-Free Status for Several African Nations",viewed,like
"COVID-19 Booster Shots Now Available for High-Risk Populations",viewed,dislike
"New Studies Link Mediterranean Diet to Reduced Heart Disease",viewed,NA
"5G Expands into Rural Communities, Enhancing Internet Connectivity",viewed,like
"Global Surge in Obesity Rates Poses Major Health Challenges",viewed,NA
"Apple’s New Vision Pro Mixed Reality Headset Expands AR Capabilities",viewed,like
"AI-Driven Personal Assistants Become Indispensable for Busy Professionals",viewed,NA
"The Emergence of Smart Cities: How IoT is Shaping Urban Living",viewed,dislike
