Title,Action,Preference
"Facebook Implements Stronger Data Privacy Controls Amid User Backlash",viewed,dislike
"AI Chatbots Transform Customer Service Industry",viewed,like
"Self-Learning AI: The Future of Machine Learning?",viewed,like
"Blockchain Technology Expands Beyond Cryptocurrency: Real-World Applications Grow",viewed,like
"The Emergence of Smart Cities: How IoT is Shaping Urban Living",viewed,like
"The Future of Wearable Tech: Smart Clothing and Health Monitoring",viewed,NA
"Microsoft Azure’s AI Model Customization Transforms Business Analytics",viewed,NA
